{
  "$schema": "https://json-schema.org/draft/2020-12/schema",
  "title": "Architecture Decision Engine Input",
  "type": "object",
  "additionalProperties": false,
  "required": [
    "schema_version",
    "assessment_id",
    "target",
    "evidence",
    "records"
  ],
  "properties": {
    "$schema": {
      "type": "string"
    },
    "schema_version": {
      "const": "1.0.0"
    },
    "assessment_id": {
      "type": "string",
      "minLength": 1
    },
    "target": {
      "type": "object",
      "additionalProperties": false,
      "required": [
        "id",
        "version",
        "environment"
      ],
      "properties": {
        "id": {
          "type": "string",
          "minLength": 1
        },
        "version": {
          "type": "string",
          "minLength": 1
        },
        "environment": {
          "type": "string",
          "minLength": 1
        }
      }
    },
    "evidence": {
      "type": "array",
      "minItems": 1,
      "items": {
        "type": "object",
        "additionalProperties": false,
        "required": [
          "id",
          "kind",
          "source",
          "age_days",
          "verified"
        ],
        "properties": {
          "id": {
            "type": "string",
            "minLength": 1
          },
          "kind": {
            "type": "string",
            "minLength": 1
          },
          "source": {
            "type": "string",
            "minLength": 1
          },
          "age_days": {
            "type": "number",
            "minimum": 0
          },
          "verified": {
            "type": "boolean"
          },
          "hash": {
            "type": "string",
            "minLength": 1
          }
        }
      }
    },
    "records": {
      "type": "array",
      "minItems": 1,
      "items": {
        "type": "object",
        "additionalProperties": false,
        "required": [
          "id",
          "category",
          "severity",
          "owner",
          "evidence_ids",
          "values"
        ],
        "properties": {
          "id": {
            "type": "string",
            "minLength": 1
          },
          "category": {
            "type": "string",
            "minLength": 1
          },
          "severity": {
            "enum": [
              "low",
              "medium",
              "high",
              "critical"
            ]
          },
          "owner": {
            "type": "string",
            "minLength": 1
          },
          "evidence_ids": {
            "type": "array",
            "minItems": 1,
            "items": {
              "type": "string",
              "minLength": 1
            }
          },
          "values": {
            "type": "object"
          },
          "notes": {
            "type": "string"
          }
        }
      }
    },
    "metadata": {
      "type": "object"
    }
  }
}
