{
  "$schema": "../../schemas/assessment.schema.json",
  "schema_version": "1.0.0",
  "assessment_id": "block-fixture",
  "target": {
    "id": "fixture-target",
    "version": "1.0.0",
    "environment": "test"
  },
  "evidence": [
    {
      "id": "E-1",
      "kind": "fixture",
      "source": "examples/fixtures",
      "age_days": 0,
      "verified": true,
      "hash": "sha256:fixture"
    }
  ],
  "records": [
    {
      "id": "R-1",
      "category": "context",
      "severity": "high",
      "owner": "fixture-owner",
      "evidence_ids": [
        "E-1"
      ],
      "values": {
        "complete": false
      }
    },
    {
      "id": "R-2",
      "category": "options",
      "severity": "high",
      "owner": "fixture-owner",
      "evidence_ids": [
        "E-1"
      ],
      "values": {
        "viable_count": 2
      }
    },
    {
      "id": "R-3",
      "category": "criteria",
      "severity": "high",
      "owner": "fixture-owner",
      "evidence_ids": [
        "E-1"
      ],
      "values": {
        "predeclared": true
      }
    },
    {
      "id": "R-4",
      "category": "decision",
      "severity": "high",
      "owner": "fixture-owner",
      "evidence_ids": [
        "E-1"
      ],
      "values": {
        "evidence_linked": true
      }
    },
    {
      "id": "R-5",
      "category": "consequences",
      "severity": "high",
      "owner": "fixture-owner",
      "evidence_ids": [
        "E-1"
      ],
      "values": {
        "documented": true
      }
    },
    {
      "id": "R-6",
      "category": "reversal",
      "severity": "high",
      "owner": "fixture-owner",
      "evidence_ids": [
        "E-1"
      ],
      "values": {
        "defined": true
      }
    }
  ],
  "metadata": {
    "expected_decision": "BLOCK"
  }
}
